{"schema":"ev4-builder-completion-authorization@1.0.0","status":"accepted","completion_scope":"builder_completion_only","session_id":"BSESSION-001","canonical_package_digest":"bbbbbbbbbbbbbbbbbbbbbbbbbbbbbbbbbbbbbbbbbbbbbbbbbbbbbbbbbbbbbbbb","selected_candidate_id":"CANDIDATE-001","final_state_capsule_sha256":"cccccccccccccccccccccccccccccccccccccccccccccccccccccccccccccccc","final_checkpoint_sha256":"dddddddddddddddddddddddddddddddddddddddddddddddddddddddddddddddd","blocking_diagnostics":[],"responsive_complete":false,"production_ready":false}
